{
  "$schema": "http://json-schema.org/draft-07/schema#",
  "title": "Class Schedule Schema",
  "description": "Schema for validating class schedule data",
  "type": "object",
  "additionalProperties": {
    "type": "array",
    "items": {
      "type": "string"
    }
  },
  "properties": {
    "0": {
      "type": "array",
      "description": "Sunday classes",
      "items": {
        "type": "string"
      }
    },
    "1": {
      "type": "array",
      "description": "Monday classes",
      "items": {
        "type": "string"
      }
    },
    "2": {
      "type": "array",
      "description": "Tuesday classes",
      "items": {
        "type": "string"
      }
    },
    "3": {
      "type": "array",
      "description": "Wednesday classes",
      "items": {
        "type": "string"
      }
    },
    "4": {
      "type": "array",
      "description": "Thursday classes",
      "items": {
        "type": "string"
      }
    },
    "5": {
      "type": "array",
      "description": "Friday classes",
      "items": {
        "type": "string"
      }
    },
    "6": {
      "type": "array",
      "description": "Saturday classes",
      "items": {
        "type": "string"
      }
    }
  }
}