{
  "0": [],
  "1": ["Power Control", "History of Powers", "Combat Training"],
  "2": ["Ethics", "Science", "Club Activities"],
  "3": ["Power Theory", "Mathematics", "Physical Education"],
  "4": ["Literature", "Power Applications", "Club Activities"],
  "5": ["Social Studies", "Elective", "Free Study"],
  "6": []
}